<?xml version="1.0" encoding="UTF-8"?>
<test_data xmlns:xsi="http://www.w3.org/2001/XMLSchema-instance"
	xsi:noNamespaceSchemaLocation="dice-text.xsd">
	<data>
		<text>0d1</text>
		<sides>1</sides>
		<quantity>0</quantity>
	</data>
	<data>
		<text>1d1</text>
		<sides>1</sides>
		<quantity>1</quantity>
	</data>
	<data>
		<text>1d6</text>
		<sides>6</sides>
		<quantity>1</quantity>
	</data>
	<data>
		<text>6d6</text>
		<sides>6</sides>
		<quantity>6</quantity>
	</data>
	<data>
		<text>2147483647d2147483647</text>
		<sides>2147483647</sides>
		<quantity>2147483647</quantity>
	</data>
</test_data>